mysql> show databases;
+--------------------+
| Database           |
+--------------------+
| information_schema |
| bakery_app         |
| cats_app           |
| mysql              |
| performance_schema |
| shirts_db          |
| sys                |
+--------------------+
7 rows in set (0.00 sec)

mysql> CREATE TABLE shirts(shirt_id INT NOT NULL AUTO_INCREMENT, article VARCHAR(255), color VARCHAR(255), shirt_size CHAR(5),last_worn INT, PRIMARY KEY (shirt_id));
Query OK, 0 rows affected (0.06 sec)

mysql> desc shirts;
+------------+--------------+------+-----+---------+----------------+
| Field      | Type         | Null | Key | Default | Extra          |
+------------+--------------+------+-----+---------+----------------+
| shirt_id   | int(11)      | NO   | PRI | NULL    | auto_increment |
| article    | varchar(255) | YES  |     | NULL    |                |
| color      | varchar(255) | YES  |     | NULL    |                |
| shirt_size | char(5)      | YES  |     | NULL    |                |
| last_worn  | int(11)      | YES  |     | NULL    |                |
+------------+--------------+------+-----+---------+----------------+
5 rows in set (0.04 sec)

mysql> INSERT INTO shirts(article,color,shirt_size,last_worn) VALUES ('t-shirt', 'white', 'S', 10), ('t-shirt', 'green', 'S', 200), ('polo shirt', 'black', 'M', 10), ('tank top', 'blue', 'S', 50), ('t-shirt', 'pink', 'S', 0), ('polo shirt', 'red', 'M', 5), ('tank top', 'white', 'S', 200), ('tank top', 'blue', 'M', 15);
Query OK, 8 rows affected (0.01 sec)
Records: 8  Duplicates: 0  Warnings: 0

mysql> SELECT * from shirts;
+----------+------------+-------+------------+-----------+
| shirt_id | article    | color | shirt_size | last_worn |
+----------+------------+-------+------------+-----------+
|        1 | t-shirt    | white | S          |        10 |
|        2 | t-shirt    | green | S          |       200 |
|        3 | polo shirt | black | M          |        10 |
|        4 | tank top   | blue  | S          |        50 |
|        5 | t-shirt    | pink  | S          |         0 |
|        6 | polo shirt | red   | M          |         5 |
|        7 | tank top   | white | S          |       200 |
|        8 | tank top   | blue  | M          |        15 |
+----------+------------+-------+------------+-----------+
8 rows in set (0.00 sec)

mysql> INSERT INTO shirts(article,color,shirt_size,last_worn) VALUES ('polo shirt', 'purple', 'M', 50);
Query OK, 1 row affected (0.01 sec)

mysql> SELECT * FROM  shirts WHERE article='polo shirt'
    -> ;
+----------+------------+--------+------------+-----------+
| shirt_id | article    | color  | shirt_size | last_worn |
+----------+------------+--------+------------+-----------+
|        3 | polo shirt | black  | M          |        10 |
|        6 | polo shirt | red    | M          |         5 |
|        9 | polo shirt | purple | M          |        50 |
+----------+------------+--------+------------+-----------+
3 rows in set (0.01 sec)

mysql> UPDATE shirts SET shirt_size='L' WHERE article='polo shirt';
Query OK, 3 rows affected (0.01 sec)
Rows matched: 3  Changed: 3  Warnings: 0

mysql> SELECT * FROM  shirts WHERE article='polo shirt'
    -> ;
+----------+------------+--------+------------+-----------+
| shirt_id | article    | color  | shirt_size | last_worn |
+----------+------------+--------+------------+-----------+
|        3 | polo shirt | black  | L          |        10 |
|        6 | polo shirt | red    | L          |         5 |
|        9 | polo shirt | purple | L          |        50 |
+----------+------------+--------+------------+-----------+
3 rows in set (0.00 sec)

mysql> UPDATE shirts SET last_worn=0 WHERE last_worn=15;
Query OK, 1 row affected (0.01 sec)
Rows matched: 1  Changed: 1  Warnings: 0

mysql> UPDATE shirts SET shirt_size='xs', color='off white' WHERE color='white';
Query OK, 2 rows affected (0.01 sec)
Rows matched: 2  Changed: 2  Warnings: 0

mysql> select * from shirts;
+----------+------------+-----------+------------+-----------+
| shirt_id | article    | color     | shirt_size | last_worn |
+----------+------------+-----------+------------+-----------+
|        1 | t-shirt    | off white | xs         |        10 |
|        2 | t-shirt    | green     | S          |       200 |
|        3 | polo shirt | black     | L          |        10 |
|        4 | tank top   | blue      | S          |        50 |
|        5 | t-shirt    | pink      | S          |         0 |
|        6 | polo shirt | red       | L          |         5 |
|        7 | tank top   | off white | xs         |       200 |
|        8 | tank top   | blue      | M          |         0 |
|        9 | polo shirt | purple    | L          |        50 |
+----------+------------+-----------+------------+-----------+
9 rows in set (0.00 sec)

mysql> DELETE from shirts WHERE last_worn=200
    -> ;
Query OK, 2 rows affected (0.01 sec)

mysql> select * from shirts;
+----------+------------+-----------+------------+-----------+
| shirt_id | article    | color     | shirt_size | last_worn |
+----------+------------+-----------+------------+-----------+
|        1 | t-shirt    | off white | xs         |        10 |
|        3 | polo shirt | black     | L          |        10 |
|        4 | tank top   | blue      | S          |        50 |
|        5 | t-shirt    | pink      | S          |         0 |
|        6 | polo shirt | red       | L          |         5 |
|        8 | tank top   | blue      | M          |         0 |
|        9 | polo shirt | purple    | L          |        50 |
+----------+------------+-----------+------------+-----------+
7 rows in set (0.00 sec)

mysql> DELETE from shirts WHERE article='tank top'
    -> ;
Query OK, 2 rows affected (0.09 sec)

mysql> select * from shirts;
+----------+------------+-----------+------------+-----------+
| shirt_id | article    | color     | shirt_size | last_worn |
+----------+------------+-----------+------------+-----------+
|        1 | t-shirt    | off white | xs         |        10 |
|        3 | polo shirt | black     | L          |        10 |
|        5 | t-shirt    | pink      | S          |         0 |
|        6 | polo shirt | red       | L          |         5 |
|        9 | polo shirt | purple    | L          |        50 |
+----------+------------+-----------+------------+-----------+
5 rows in set (0.00 sec)

mysql> DELETE from shirts;
Query OK, 5 rows affected (0.04 sec)

mysql> DROP TABLE shirts;
Query OK, 0 rows affected (0.09 sec)

